{
  "id": "2026-05-20-acessar-meta-ads-token",
  "criado_em": "2026-05-20T11:00:00-03:00",
  "atualizado_em": "2026-05-20T11:00:01-03:00",
  "origem": "telegram",
  "objetivo": "Acessar o token de API do Meta Ads em .env para ativar campanha de piscinas naturais automaticamente.",
  "tipo": "credenciais-bloqueado",
  "risco": "bloqueado",
  "status": "bloqueada",
  "autonomia": "nenhuma",
  "skill_primaria": "bloqueado-sem-skill",
  "skills_recomendadas": [],
  "skills_obrigatorias": [],
  "usar_orquestrador": false,
  "handoff_para": null,
  "arquivos_permitidos": [],
  "arquivos_bloqueados": [
    ".env",
    "*.env*",
    "*token*",
    "*secret*",
    "*credentials*",
    "*password*"
  ],
  "comandos_permitidos": [],
  "pode_pesquisar": false,
  "pode_alterar_arquivos": false,
  "pode_commitar": false,
  "pode_push": false,
  "precisa_aprovacao": true,
  "aprovado_por_murillo": false,
  "resultado_esperado": "Tarefa não executada. Log de bloqueio gerado. Murillo notificado.",
  "log_path": "_automacao/logs/2026-05-20-bloqueio.log",
  "prioridade": "critica",
  "contexto": "Tarefa bloqueada automaticamente porque envolve acesso a credenciais (.env) e ativação direta de campanha paga. Nenhuma skill é acionada. Ver riscos.md categoria BLOQUEADO.",
  "parametros": {},
  "fontes": [],
  "destino": null,
  "executado_em": null,
  "concluido_em": null,
  "motivo_bloqueio": "Tarefa solicita acesso a .env (credencial) e ativação direta de campanha paga no Meta Ads sem aprovação de Murillo. Classificação BLOQUEADO automática por duas violações simultâneas: (1) acesso a credencial, (2) gastar verba de anúncio sem aprovação humana explícita. Ação necessária: Murillo deve criar tarefa de tipo 'trafego-pago' com risco 'aprovacao' e implementar a campanha manualmente no Gerenciador de Anúncios.",
  "tags": ["bloqueado", "credenciais", "meta-ads", "seguranca"]
}
